ocr_result_id,page_no,id,jgroupid_string,cif_number,settlement_at,maker_name_original,maker_name,maker_com_code,issue_date_rightside_date,issue_date,due_date_rightside_date,due_date,balance_rightside,balance,payment_bank_name_rightside,payment_bank_name,payment_bank_branch_name_rightside,payment_bank_branch_name,description_rightside,description
,,1,000,901803,202507,科目,科目,,名称(氏名),名称(氏名),所在地(住所),所在地(住所),,,期末現在高,期末現在高,摘要,摘要,,
,,2,000,901803,202507,売掛金,売掛金,,(株)カティグレイス,(株)カティグレイス,東京都台東区三筋2-20-10,東京都台東区三筋2-20-10,,,206084630,206084630,,,,
,,3,000,901803,202507,,,,(株)伊勢半,(株)伊勢半,東京都千代田区四番町6-11,東京都千代田区四番町6-11,,,192529192,192529192,,,,
,,4,000,901803,202507,,,,CHEMICOSCHINA,CHEMICOSCHINA,"#4556,CIHURD. , JINJIAZHUAANGAREA,MAANSHAN-CITY,","#4556,CIHURD. , JINJIAZHUAANGAREA,MAANSHAN-CITY,",,,61999441,61999441,,,,
,,5,000,901803,202507,,,,(株)ディーアップ,(株)ディーアップ,東京都港区北青山3-3-11ルネ青山ビル6階,東京都港区北青山3-3-11ルネ青山ビル6階,,,25547672,25547672,,,,
,,6,000,901803,202507,,,,(株)井田ラボラトリーズ,(株)井田ラボラトリーズ,東京都千代田区麹町4-2-6住友不動産麹町ファーストビル,東京都千代田区麹町4-2-6住友不動産麹町ファーストビル,,,25001064,25001064,,,,
,,7,000,901803,202507,,,,エルソルプロダクツ(株),エルソルプロダクツ(株),静岡県掛川市淡陽8番地,静岡県掛川市淡陽8番地,,,22814286,22814286,,,,
,,8,000,901803,202507,,,,(株)フローフシ,(株)フローフシ,東京都港区六本木4-1-28グレイハウス2階,東京都港区六本木4-1-28グレイハウス2階,,,20196000,20196000,,,,
,,9,000,901803,202507,,,,(株)スタイリングライフ・ホールディングスBCLカンパニ,(株)スタイリングライフ・ホールディングスBCLカンパニ,東京都新宿区北新宿2-21-1新宿フロントタワー27階,東京都新宿区北新宿2-21-1新宿フロントタワー27階,,,18615072,18615072,,,,
,,10,000,901803,202507,,,,msh(株),msh(株),東京都渋谷区渋谷3-3-2渋谷MKビル4階,東京都渋谷区渋谷3-3-2渋谷MKビル4階,,,11055000,11055000,,,,
,,11,000,901803,202507,,,,(株)ノエビア,(株)ノエビア,兵庫県神戸市中央区港島中町6-13-1,兵庫県神戸市中央区港島中町6-13-1,,,10958191,10958191,,,,
,,12,000,901803,202507,,,,CHEMICOSKOREA,CHEMICOSKOREA,"2F,204-3,Anyang-Dong,Manan-kuAnyang-Si,KOREA43","2F,204-3,Anyang-Dong,Manan-kuAnyang-Si,KOREA43",,,5472897,5472897,,,,
,,13,000,901803,202507,,,,(株)MIMC,(株)MIMC,東京都千代田区岩本町3-5-5岩本町三丁目ビル8階,東京都千代田区岩本町3-5-5岩本町三丁目ビル8階,,,5020400,5020400,,,,
,,14,000,901803,202507,,,,アヴァンセ(株),アヴァンセ(株),東京都港区六本木6-4-1ハリウッドビューティプラザ4F,東京都港区六本木6-4-1ハリウッドビューティプラザ4F,,,4841819,4841819,,,,
,,15,000,901803,202507,,,,(株)アメイズプラス,(株)アメイズプラス,愛知県名古屋市中村区太閤3-1-18名古屋KSビル4階,愛知県名古屋市中村区太閤3-1-18名古屋KSビル4階,,,3465000,3465000,,,,
,,16,000,901803,202507,,,,(株)宇津木産業,(株)宇津木産業,東京都中央区日本橋本石町3-2-6ストークビルヂング本石町,東京都中央区日本橋本石町3-2-6ストークビルヂング本石町,,,3194466,3194466,,,,
,,17,000,901803,202507,,,,(株)ポーラ,(株)ポーラ,東京都品川区西五反田2-2-3,東京都品川区西五反田2-2-3,,,3171520,3171520,,,,
,,18,000,901803,202507,,,,東洋ビューティ(株),東洋ビューティ(株),三重県伊賀市ゆめが丘7-6-1,三重県伊賀市ゆめが丘7-6-1,,,2860000,2860000,,,,
,,19,000,901803,202507,,,,(株)Rainmakers,(株)Rainmakers,東京都中央区新富1-8-9+SHIFTGINZAEAST4階,東京都中央区新富1-8-9+SHIFTGINZAEAST4階,,,2655840,2655840,,,,
,,20,000,901803,202507,,,,イリヤ化学(株),イリヤ化学(株),愛知県名古屋市千種区小松町6-27,愛知県名古屋市千種区小松町6-27,,,2475000,2475000,,,,
,,21,000,901803,202507,,,,(株)ヘイゼルトンプソン,(株)ヘイゼルトンプソン,新潟県新潟市東区逢谷内6-8-3,新潟県新潟市東区逢谷内6-8-3,,,2208717,2208717,,,,
,,22,000,901803,202507,,,,(株)コスメディアラボラトリーズ,(株)コスメディアラボラトリーズ,横浜市金沢区幸浦2-20-5,横浜市金沢区幸浦2-20-5,,,1351240,1351240,,,,
,,23,000,901803,202507,,,,(株)ピカソ美化学研究所,(株)ピカソ美化学研究所,兵庫県西宮市西宮浜3-9-1,兵庫県西宮市西宮浜3-9-1,,,1049070,1049070,,,,
,,24,000,901803,202507,,,,(株)マッシュビューティーラボ,(株)マッシュビューティーラボ,東京都千代田区麹町5-7-1麹町ダイビル5階,東京都千代田区麹町5-7-1麹町ダイビル5階,,,902000,902000,,,,
,,25,000,901803,202507,,,,(株)Clue,(株)Clue,東京都中央区新富1-8-9+SHIFTGINZAEAST4階,東京都中央区新富1-8-9+SHIFTGINZAEAST4階,,,119350,119350,,,,
,,26,000,901803,202507,,,,上海美塾貿易会社,上海美塾貿易会社,"ROOME160,No.2800,WANYUANROAD,MINHANGDISTR","ROOME160,No.2800,WANYUANROAD,MINHANGDISTR",,,60000,60000,,,,
,,27,000,901803,202507,,,,その他,その他,,,,,2,2,,,,
,,28,000,901803,202507,計,計,,,,,,,,,,,,,
