ocr_result_id,page_no,id,jgroupid_string,cif_number,settlement_at,maker_name_original,maker_name,maker_com_code,issue_date_rightside_date,issue_date,due_date_rightside_date,due_date,balance_rightside,balance,payment_bank_name_rightside,payment_bank_name,payment_bank_branch_name_rightside,payment_bank_branch_name,description_rightside,description
,,1,000,873520,202507,借入先名称(氏名),借入先名称(氏名),,借入先所在地(住所),借入先所在地(住所),法人・代表者との関係,法人・代表者との関係,利率,利率,期末現在高,期末現在高,期中の支払利子額,期中の支払利子額,担保の内容,
,,2,000,873520,202507,城北信用金庫赤羽支店,城北信用金庫赤羽支店,,,,,,1.000,1.000,9998000,9998000,,,短期借入金,
,,3,000,873520,202507,武蔵野銀行川口支店,武蔵野銀行川口支店,,,,,,1.400,1.400,20004000,20004000,,,1年以内返済,
,,4,000,873520,202507,武蔵野銀行川口支店,武蔵野銀行川口支店,,,,,,1.400,1.400,79996000,79996000,,,長期借入金,
,,5,000,873520,202507,,,,計,計,,,,,944612036,944612036,,,,
