ocr_result_id,page_no,id,jgroupid_string,cif_number,settlement_at,maker_name_original,maker_name,maker_com_code,issue_date_rightside_date,issue_date,due_date_rightside_date,due_date,balance_rightside,balance,payment_bank_name_rightside,payment_bank_name,payment_bank_branch_name_rightside,payment_bank_branch_name,description_rightside,description
,,1,000,192088,202507,科目,科目,,名称(氏名),名称(氏名),所在地(住所),所在地(住所),,,期末現在高,期末現在高,摘要,摘要,,
,,2,000,192088,202507,買掛金,買掛金,,前田電気管理事務所,前田電気管理事務所,和歌山県新宮市佐野1708-1,和歌山県新宮市佐野1708-1,,,17600,17600,,,,
,,3,000,192088,202507,買掛金,買掛金,,三重いすゞ自動車(株)熊野営業所,三重いすゞ自動車(株)熊野営業所,三重県熊野市有馬町3724-6,三重県熊野市有馬町3724-6,,,4866639,4866639,,,,
,,4,000,192088,202507,買掛金,買掛金,,(有)向島ボールト製作所,(有)向島ボールト製作所,千葉県松戸市小山403,千葉県松戸市小山403,,,495000,495000,,,,
,,5,000,192088,202507,買掛金,買掛金,,(株)メイキ産業,(株)メイキ産業,大阪府和泉市福瀬町898番地の1,大阪府和泉市福瀬町898番地の1,,,526296,526296,,,,
,,6,000,192088,202507,合計,合計,,,,,,,,42282736,42282736,,,,
