file_path,original_file_name,page_index,row_number,original_header_text,column_1_value,column_2_value,column_3_value,column_4_value,column_5_value,column_6_value,column_7_value,column_8_value,column_9_value,column_10_value,column_11_value,column_12_value,column_13_value,column_14_value,column_15_value,column_16_value,column_17_value,column_18_value,column_19_value,column_20_value
,,,0,借入先名称(氏名),借入先名称(氏名),借入先所在地(住所),法人・代表者との関係,期末現在高,期中の支払利子額,利率,担保の内容,,,,,,,,,,,,,
,,,1,日本政策金融公庫/京都,日本政策金融公庫/京都,京都市中京区東洞院通蛸薬師下ル天竹田町,,29544000,,,,,,,,,,,,,,,,
,,,2,京都/大官,京都/大官,京都市下京区四条通猪熊東入唐津屋町510,,185368000,,,,,,,,,,,,,,,,
,,,3,京都中央信金/大宮,京都中央信金/大宮,京都市下京区大宮通松原下ル下五条町,,24804000,,,,,,,,,,,,,,,,
,,,4,滋賀/京都,滋賀/京都,京都市下京区烏丸通四条下ル水銀屋町630,,35000000,,,,,,,,,,,,,,,,
,,,5,関西みらい/御池,関西みらい/御池,京都市中京区烏丸通御池上る二条殿町522番地,,46804000,,,,,,,,,,,,,,,,
,,,6,商工組合中央金庫/京都,商工組合中央金庫/京都,京都市下京区綾小路通鳥丸西入童侍町1591,,56000000,,,,,,,,,,,,,,,,
,,,7,りそな/京都,りそな/京都,京都市中京区烏丸通四条上ル笋町691,,58519000,,,,,,,,,,,,,,,,
,,,8,,,計,,436039000,,,,,,,,,,,,,,,,
