ocr_result_id,page_no,id,jgroupid_string,cif_number,settlement_at,maker_name_original,maker_name,maker_com_code,issue_date_rightside_date,issue_date,due_date_rightside_date,due_date,balance_rightside,balance,payment_bank_name_rightside,payment_bank_name,payment_bank_branch_name_rightside,payment_bank_branch_name,description_rightside,description
,,1,000,144451,202507,科目,科目,,名称(氏名),名称(氏名),所在地(住所),所在地(住所),,,期末現在高,期末現在高,摘要,摘要,,
,,2,000,144451,202507,売掛金,売掛金,,JーNET株式会社,JーNET株式会社,広島県広島市西区商エセンター1-3-22,広島県広島市西区商エセンター1-3-22,,,607465,607465,,,,
,,3,000,144451,202507,売掛金,売掛金,,20neo通信販売,20neo通信販売,東京都渋谷区道玄坂1-14-6ヒューマックス渋谷ビル7F,東京都渋谷区道玄坂1-14-6ヒューマックス渋谷ビル7F,,,596995,596995,,,,
,,4,000,144451,202507,売掛金,売掛金,,ジェイオーコスメティックス株式会社,ジェイオーコスメティックス株式会社,東京都大田区大森西3-11-14,東京都大田区大森西3-11-14,,,539000,539000,,,,
,,5,000,144451,202507,売掛金,売掛金,,株式会社ファンケル,株式会社ファンケル,神奈川県横浜市中区山下町89-1,神奈川県横浜市中区山下町89-1,,,526680,526680,,,,
,,6,000,144451,202507,売掛金,売掛金,,株式会社ラクーンフィナンシャル,株式会社ラクーンフィナンシャル,東京都中央区日本橋蛎殻町1-14-14,東京都中央区日本橋蛎殻町1-14-14,,,516363,516363,,,,
,,7,000,144451,202507,売掛金,売掛金,,その他41件,その他41件,,,,,3050042,3050042,,,,
,,8,000,144451,202507,売掛金計,売掛金計,,,,,,,,1495270301,1495270301,,,,
