file_path,original_file_name,page_index,row_number,original_header_text,column_1_value,column_2_value,column_3_value,column_4_value,column_5_value,column_6_value,column_7_value,column_8_value,column_9_value,column_10_value,column_11_value,column_12_value,column_13_value,column_14_value,column_15_value,column_16_value,column_17_value,column_18_value,column_19_value,column_20_value
,,,0,科目,科目,名称(氏名),所在地(住所),期末現在高,摘要,,,,,,,,,,,,,,,
,,,1,売掛金,売掛金,トーカイ・パッケージングシステム(株),神奈川県藤沢市湘南台1-6-3ハイコート湘南2階,722216,,,,,,,,,,,,,,,,
,,,2,売掛金,売掛金,その他,,246649557,,,,,,,,,,,,,,,,
,,,3,未収入金,未収入金,(株)ディー・シィー・エス,兵庫県神戸市西区伊川谷町有瀬301,5942341,,,,,,,,,,,,,,,,
,,,4,未収入金,未収入金,リコージャパン(株)兵庫支社,兵庫県神戸市中央区磯辺通1-1-39,27420,,,,,,,,,,,,,,,,
,,,5,未収入金,未収入金,キャノンマーケティングジャパン(株),千葉県千葉市美浜区中瀬1-7-2,86867,"5,6月分",,,,,,,,,,,,,,,
,,,6,未収入金,未収入金,サントリービバレッジサービス株式会社,兵庫県姫路市四郷町山脇70,6941,4～6月分,,,,,,,,,,,,,,,
,,,7,未収入金,未収入金,(株)ティーガイヤ,大阪府大阪市北区堂島1-6-20,16500,6月分,,,,,,,,,,,,,,,
,,,8,計,計,,,495832587,,,,,,,,,,,,,,,,
